[
  {
    "allocator": "rotation",
    "alpha": 0.6180339887498949,
    "alphaMode": "irrational",
    "anchor": "Badly approximable baseline with N=34",
    "beta": 0.31,
    "category": "Irrational rotations",
    "expression": "(sqrt(5)-1)/2",
    "id": "golden-baseline",
    "name": "Golden conjugate",
    "nameEs": "Conjugado \u00e1ureo",
    "phase": 0,
    "pointCount": 34,
    "rationalP": 5,
    "rationalQ": 13,
    "seed": 17,
    "strictBeta": true
  },
  {
    "allocator": "rotation",
    "alpha": 0.41421356237309515,
    "alphaMode": "irrational",
    "anchor": "Independent quadratic irrational with N=41",
    "beta": 0.27,
    "category": "Irrational rotations",
    "expression": "sqrt(2)-1",
    "id": "silver-ratio",
    "name": "Silver conjugate",
    "nameEs": "Conjugado plateado",
    "phase": 0,
    "pointCount": 41,
    "rationalP": 5,
    "rationalQ": 12,
    "seed": 17,
    "strictBeta": true
  },
  {
    "allocator": "rotation",
    "alpha": 0.7320508075688772,
    "alphaMode": "irrational",
    "anchor": "Quadratic irrational with a different continued fraction",
    "beta": 0.36,
    "category": "Irrational rotations",
    "expression": "sqrt(3)-1",
    "id": "sqrt-three",
    "name": "Square-root-three tail",
    "nameEs": "Cola de ra\u00edz de tres",
    "phase": 0,
    "pointCount": 55,
    "rationalP": 11,
    "rationalQ": 15,
    "seed": 17,
    "strictBeta": true
  },
  {
    "allocator": "rotation",
    "alpha": 0.7182818284590451,
    "alphaMode": "irrational",
    "anchor": "Known irrational constant in the numerical lane",
    "beta": 0.29,
    "category": "Transcendental rotations",
    "expression": "e-2",
    "id": "e-tail",
    "name": "Euler tail",
    "nameEs": "Cola de Euler",
    "phase": 0,
    "pointCount": 47,
    "rationalP": 18,
    "rationalQ": 25,
    "seed": 17,
    "strictBeta": true
  },
  {
    "allocator": "rotation",
    "alpha": 0.14159265358979312,
    "alphaMode": "irrational",
    "anchor": "Small irrational angle with N=64",
    "beta": 0.22,
    "category": "Transcendental rotations",
    "expression": "pi-3",
    "id": "pi-tail",
    "name": "Pi tail",
    "nameEs": "Cola de pi",
    "phase": 0,
    "pointCount": 64,
    "rationalP": 1,
    "rationalQ": 7,
    "seed": 17,
    "strictBeta": true
  },
  {
    "allocator": "rotation",
    "alpha": 0.6180339887498949,
    "alphaMode": "irrational",
    "anchor": "Checks rotational invariance of gap lengths",
    "beta": 0.31,
    "category": "Phase and finite size",
    "expression": "phi-1 with phase",
    "id": "phase-shifted-golden",
    "name": "Phase-shifted golden",
    "nameEs": "\u00c1ureo con fase",
    "phase": 0.2718281828,
    "pointCount": 34,
    "rationalP": 5,
    "rationalQ": 13,
    "seed": 17,
    "strictBeta": true
  },
  {
    "allocator": "rotation",
    "alpha": 0.6180339887498949,
    "alphaMode": "irrational",
    "anchor": "Small finite orbit with N=7",
    "beta": 0.4,
    "category": "Phase and finite size",
    "expression": "(sqrt(5)-1)/2",
    "id": "low-n-golden",
    "name": "Low-N golden",
    "nameEs": "\u00c1ureo con N bajo",
    "phase": 0,
    "pointCount": 7,
    "rationalP": 5,
    "rationalQ": 13,
    "seed": 17,
    "strictBeta": true
  },
  {
    "allocator": "rotation",
    "alpha": 0.38462538461538465,
    "alphaMode": "numeric",
    "anchor": "Near-rational stress case, not an irrationality certificate",
    "beta": 0.31,
    "category": "Numerical conditioning",
    "expression": "5/13 + 1e-5",
    "id": "near-five-thirteenths",
    "name": "Near 5/13",
    "nameEs": "Cerca de 5/13",
    "phase": 0,
    "pointCount": 89,
    "rationalP": 5,
    "rationalQ": 13,
    "seed": 17,
    "strictBeta": true
  },
  {
    "allocator": "rotation",
    "alpha": 0.38461538461538464,
    "alphaMode": "rational",
    "anchor": "Periodic collision boundary",
    "beta": 0.31,
    "category": "Rational boundaries",
    "expression": "5/13",
    "id": "rational-five-thirteenths",
    "name": "Rational 5/13",
    "nameEs": "Racional 5/13",
    "phase": 0,
    "pointCount": 34,
    "rationalP": 5,
    "rationalQ": 13,
    "seed": 17,
    "strictBeta": true
  },
  {
    "allocator": "rotation",
    "alpha": 0.38095238095238093,
    "alphaMode": "rational",
    "anchor": "Second periodic denominator and collision pattern",
    "beta": 0.33,
    "category": "Rational boundaries",
    "expression": "8/21",
    "id": "rational-eight-twenty-one",
    "name": "Rational 8/21",
    "nameEs": "Racional 8/21",
    "phase": 0.1,
    "pointCount": 55,
    "rationalP": 8,
    "rationalQ": 21,
    "seed": 17,
    "strictBeta": true
  },
  {
    "allocator": "farthest",
    "alpha": 0.6180339887498949,
    "alphaMode": "irrational",
    "anchor": "Deterministic non-rotation contrast",
    "beta": 0.31,
    "category": "Process contrasts",
    "expression": "greedy largest-gap bisection",
    "id": "farthest-contrast",
    "name": "Farthest-point allocator",
    "nameEs": "Asignador del punto m\u00e1s lejano",
    "phase": 0,
    "pointCount": 34,
    "rationalP": 5,
    "rationalQ": 13,
    "seed": 17,
    "strictBeta": true
  },
  {
    "allocator": "random",
    "alpha": 0.6180339887498949,
    "alphaMode": "irrational",
    "anchor": "Reproducible non-arithmetic negative control",
    "beta": 0.31,
    "category": "Process contrasts",
    "expression": "deterministic PRNG seed 73",
    "id": "seeded-random-contrast",
    "name": "Seeded random",
    "nameEs": "Aleatorio con semilla",
    "phase": 0,
    "pointCount": 34,
    "rationalP": 5,
    "rationalQ": 13,
    "seed": 73,
    "strictBeta": true
  }
]
